{
  "schemaVersion": "1.0.0",
  "protocolId": "66666666-6666-4666-8666-666666666666",
  "projectId": "11111111-1111-4111-8111-111111111111",
  "assembly": {
    "guid": "33333333-3333-4333-8333-333333333333",
    "positionNumber": "BG12345",
    "revision": 4,
    "modelSha256": "7fe5a6916074d3e6f609fcdeb18a142aca59e0137a818d403f4f53bed8ef1490"
  },
  "operator": {
    "userId": "user01",
    "displayName": "Operario de ejemplo"
  },
  "device": {
    "manufacturer": "Samsung",
    "model": "S25 Ultra",
    "platform": "ANDROID",
    "osVersion": "Android 16",
    "appVersion": "1.0.0"
  },
  "timing": {
    "startedAt": "2026-07-02T10:15:00Z",
    "completedAt": "2026-07-02T10:27:30Z",
    "durationSeconds": 750
  },
  "registration": {
    "method": "RAW_DEPTH_PCA_ICP",
    "worldFromAssembly": [
      1,
      0,
      0,
      0,
      0,
      1,
      0,
      0,
      0,
      0,
      1,
      0,
      1,
      0.8,
      2,
      1
    ],
    "rmseMm": 4.8,
    "coverage": 0.82,
    "ambiguityRatio": 1.6,
    "depthPointCount": 2840,
    "quality": "GOOD",
    "capturedAt": "2026-07-02T10:18:06Z"
  },
  "gravity": {
    "worldUp": [
      0,
      1,
      0
    ],
    "assemblyUpInWorld": [
      0,
      1,
      0
    ],
    "tiltDeg": 0
  },
  "result": "REWORK",
  "issues": [
    {
      "issueId": "77777777-7777-4777-8777-777777777777",
      "partGuid": "55555555-5555-4555-8555-555555555555",
      "type": "HOLE_MISMATCH",
      "severity": "MAJOR",
      "description": "Taladro superior desplazado respecto al modelo.",
      "photoIds": [
        "88888888-8888-4888-8888-888888888888"
      ]
    }
  ],
  "photos": [
    {
      "photoId": "88888888-8888-4888-8888-888888888888",
      "path": "photos/88888888-8888-4888-8888-888888888888.jpg",
      "sha256": "aaaaaaaaaaaaaaaaaaaaaaaaaaaaaaaaaaaaaaaaaaaaaaaaaaaaaaaaaaaaaaaa",
      "takenAt": "2026-07-02T10:23:10Z"
    }
  ],
  "comments": "Revisar la posición del taladro antes de liberar la Baugruppe.",
  "signature": {
    "signedBy": "user01",
    "signedAt": "2026-07-02T10:27:30Z",
    "method": "TYPED_NAME",
    "value": "Operario de ejemplo"
  }
}
